<?xml version="1.0" encoding="UTF-8"?>
<!DOCTYPE guzz-configs PUBLIC "-//GUZZ//DTD MAIN CONFIG//EN" "http://www.guzz.org/dtd/guzz.dtd">

<guzz-configs>
	
	<config-server>
		<server class="org.guzz.config.LocalFileConfigServer">
			<param name="resource" value="guzz_test2.properties" />
			<param name="optionalResource" value="additional.properties" />
		</server>
	</config-server>
	
	<dialect class="org.guzz.dialect.H2Dialect"></dialect>
	<dialect name="mysql5dialect" class="org.guzz.dialect.Mysql5Dialect" />
	<dialect name="oracle10gdialect" class="org.guzz.dialect.Oracle10gDialect" />
	
	<tran locator="spring">
		<dbgroup name="default" masterDBConfigName="masterDB" />
		<dbgroup name="mysql" masterDBConfigName="mysqlDB" dialectName="mysql5dialect" />
		<dbgroup name="oracle" masterDBConfigName="oracleDB" dialectName="oracle10gdialect" />
		
		<virtualdbgroup name="cargoDB" dialectName="default" shadow="org.guzz.test.shop.CargoVirtualDBView" >
			<dbgroup name="cargoDB.cargo2" masterDBConfigName="cargo2DB" />
		</virtualdbgroup>
		
		<virtualdbgroup name="commentDB" dialectName="default" shadow="org.guzz.test.CommentVirtualDBView" />
		
		<virtualdbgroup name="other" dialectName="mysql5dialect" shadow="org.guzz.test.shop.CargoVirtualDBView" />
	</tran>
	
	<service name="onlyForTest" configName="onlyForTestConfig" class="org.guzz.test.sample.SampleTestService" />
	<service name="onlyForTest2" configName="onlyForTest2Config" dependsOn="onlyForTest" class="org.guzz.test.sample.SampleTestService2" />
	<service name="guzzDynamicSQL" configName="guzzDynamicSQL" class="org.guzz.service.core.impl.FileDynamicSQLServiceImpl" />
	
	<import resource="include/part2.xml" />

	<a-business name="user" dbgroup="default" class="org.guzz.test.User"/>
	<a-business name="book" class="org.guzz.test.Book" />
	<a-business name="userInfo" dbgroup="oracle" class="org.guzz.test.UserInfo" />
	<a-business name="userInfo2" dbgroup="default" class="org.guzz.test.UserInfoH2" />
	<a-business name="comment" dbgroup="commentDB" class="org.guzz.test.Comment"/>
	<a-business name="cargo" dbgroup="cargoDB" class="org.guzz.test.shop.Cargo" />
	<a-business name="sp" class="org.guzz.test.shop.SpecialProperty" />
	
	<sqlMap dbgroup="default">
		<select id="selectUser" orm="user">
			select * from @@user
			 where 
			 	@id = :id 
			
			<paramsMapping>
				<map paramName="id" type="int" />
			</paramsMapping>
		</select>
		
		<select id="selectUserByName" orm="user" result-class="java.util.HashMap">
			select @id, @userName, @vip, @password from @@user where @userName = :userName
			
			<paramsMapping>
				<map paramName="userName" propName="userName" />
			</paramsMapping>
		</select>
	
		<update id="updateUserFavCount" orm="userObjectMap">
			update @@user set @favCount = favCount + 1
		</update>
	
		<select id="getCount" orm="user">
			select 30 as totalCount
		</select>
		
		<select id="selectUserByName2" orm="user" result-class="java.util.HashMap">
			select pk, userName, VIP_USER, MyPSW, FAV_COUNT from TB_USER where userName = :userName
		</select>
		
		<select id="selectUsers" orm="userObjectMap">
			select @id, @name, @vip, @favCount from @@user
		</select>
		
		<select id="listCommentsByName" orm="commentMap" >
			select * from @@commentMap where @userName = :userName
			
			<paramsMapping>
				<map paramName="userName" propName="userName" />
			</paramsMapping>
		</select>
				
		<orm id="userObjectMap" class="org.guzz.test.UserModel">
			<result property="id" column="pk"/>
		    <result property="name" column="userName"/>
		    <result property="favCount" column="FAV_COUNT"/>
		    <result property="vip" column="VIP_USER"/>
		</orm>
		
		<orm id="commentMap" dbgroup="commentDB" class="org.guzz.test.Comment" table="TB_COMMENT" shadow="org.guzz.test.CommentShadowView">
			<result property="id" column="id" type="int"/>
		    <result property="userId" column="userId" type="int"/>
		    <result property="userName" column="userName" type="string" />
		    <result property="createdTime" column="createdTime" type="datetime" />
		</orm>
	</sqlMap>
	
	<sqlMap dbgroup="cargoDB">
		<select id="selectCrossSize" orm="cargo" result-class="org.guzz.orm.rdms.MyCrossStitch">
			select name, price, gridNum, size, brand from @@cargo where id > :id
		</select>
	</sqlMap>

</guzz-configs>